{
 "schema_version": "1.0",
 "command_id": "CMD-0004",
 "task_id": "TID-2026-09-14-p",
 "result": "succeeded",
 "revision_after": "9c29eff68af11b2dd2e6d46f17ec6e838c20392c",
 "evidence": [
  {
   "path": "evidence/tasks/TID-2026-09-14-p/artifacts/render_check.txt",
   "sha256": "1fadceac7704f1284daebec43c2546853b8d6bc05d61ae45413c945e9f0f7d6f"
  }
 ]
}